{
  "analysis_cache": {
    "hit": false,
    "key": "fixture",
    "path": "%ARCHIVE_ROOT%\\analysis-cache\\fixture.json"
  },
  "analysis_id": "fixture-analysis-repair-heavy",
  "analysis_path": "%ARCHIVE_ROOT%\\reports\\fixture\\analysis.json",
  "artifacts": {
    "analysis": "%ARCHIVE_ROOT%\\reports\\fixture\\analysis.json",
    "race-card.md": "%ARCHIVE_ROOT%\\reports\\fixture\\race-card.md",
    "report": "%ARCHIVE_ROOT%\\reports\\fixture\\report.md"
  },
  "context": {
    "car_key": "nascar-test-car",
    "race_length_key": "80-laps",
    "season_key": "2026-s3",
    "setup_type": "open",
    "track_key": "synthetic-speedway-oval"
  },
  "damage_repair": {
    "channel_coverage": {
      "driver_fast_repair_request": {
        "channel": "dpFastRepair",
        "status": "recorded",
        "unit": null
      },
      "fast_repairs_available": {
        "channel": "FastRepairAvailable",
        "status": "recorded",
        "unit": null
      },
      "fast_repairs_used": {
        "channel": "PlayerFastRepairsUsed",
        "status": "recorded",
        "unit": null
      },
      "incident_points": {
        "channel": "PlayerCarMyIncidentCount",
        "status": "recorded",
        "unit": null
      },
      "mandatory_repair_timer": {
        "channel": "PitRepairLeft",
        "status": "recorded",
        "unit": "s"
      },
      "optional_repair_timer": {
        "channel": "PitOptRepairLeft",
        "status": "recorded",
        "unit": "s"
      },
      "pit_road": {
        "channel": "OnPitRoad",
        "status": "recorded",
        "unit": null
      },
      "pit_service_active": {
        "channel": "PitstopActive",
        "status": "recorded",
        "unit": null
      },
      "pit_service_request_flags": {
        "channel": "PitSvFlags",
        "status": "recorded",
        "unit": null
      },
      "pit_service_status": {
        "channel": "PlayerCarPitSvStatus",
        "status": "recorded",
        "unit": null
      },
      "pit_stall": {
        "channel": "PlayerCarInPitStall",
        "status": "recorded",
        "unit": null
      },
      "repair_required_flag": {
        "channel": "SessionFlags",
        "status": "recorded",
        "unit": null
      },
      "tow_timer": {
        "channel": "PlayerCarTowTime",
        "status": "recorded",
        "unit": "s"
      }
    },
    "episodes": [
      {
        "affected_completed_lap_numbers": [
          31
        ],
        "candidate_lap_numbers": [
          31,
          32
        ],
        "classification": "tow_and_recorded_repair_timer",
        "damage_evidence": {
          "location": null,
          "note": "Recorded timers establish repair activity but do not measure damage location or severity.",
          "severity": null,
          "status": "recorded_repair_timer_positive"
        },
        "end_sample_index": 22048,
        "end_session_time_s": 1102.4,
        "episode_elapsed_s": 92.4,
        "episode_id": "damage-repair-001",
        "fast_repair": {
          "available_at_episode_end": 1.0,
          "available_at_episode_start": 1.0,
          "available_counter_channel": "FastRepairAvailable",
          "confirmation_rule": "A request flag is not proof of use; only a recorded used-counter increment confirms fast-repair use.",
          "request_confirmed_as_use": false,
          "request_source_channels": [
            "PitSvFlags",
            "dpFastRepair"
          ],
          "requested": true,
          "requested_by_driver_trace": true,
          "requested_by_pit_service_flags": true,
          "used_count_after": 0.0,
          "used_count_before": 0.0,
          "used_count_delta": 0.0,
          "used_counter_channel": "PlayerFastRepairsUsed"
        },
        "incident_points_context": {
          "damage_proof": false,
          "events_near_episode": [
            "incident-points-001"
          ],
          "note": "Incident points are context only and do not establish physical damage.",
          "points_added_near_episode": 4.0,
          "repair_correlated_candidate": {
            "candidate_lap_numbers": [
              30,
              31,
              32
            ],
            "candidate_start_lap": 30,
            "candidate_through_lap": 32,
            "damage_onset_confirmed": false,
            "incident_event_id": "incident-points-001",
            "note": "Latest preceding incident-count increase is a conservative candidate boundary, not confirmed damage onset.",
            "status": "inferred_candidate_boundary"
          }
        },
        "mandatory_repair": {
          "completion_status": "counted_down_to_zero",
          "countdown_observed_s": 12.0,
          "countdown_progress_elapsed_s": 12.0,
          "countdown_progress_first_sample_index": 20800,
          "countdown_progress_last_sample_index": 21039,
          "countdown_progress_sample_count": 240,
          "first_positive_remaining_s": 12.0,
          "last_positive_remaining_s": 0.05,
          "minimum_positive_remaining_s": 0.05,
          "peak_remaining_s": 12.0,
          "remaining_at_stall_exit_s": 0.0,
          "repair_work_completed_s": 12.0,
          "source_channel": "PitRepairLeft",
          "source_unit": "s",
          "status": "recorded_positive_timer",
          "timer_positive_observed_s": 12.0
        },
        "optional_repair": {
          "completion_status": "remaining_at_stall_exit",
          "countdown_observed_s": 31.5,
          "countdown_progress_elapsed_s": 31.5,
          "countdown_progress_first_sample_index": 21040,
          "countdown_progress_last_sample_index": 21669,
          "countdown_progress_sample_count": 630,
          "first_positive_remaining_s": 80.0,
          "last_positive_remaining_s": 48.5,
          "minimum_positive_remaining_s": 48.5,
          "peak_remaining_s": 80.0,
          "remaining_at_stall_exit_s": 48.5,
          "repair_work_completed_s": 31.5,
          "source_channel": "PitOptRepairLeft",
          "source_unit": "s",
          "status": "recorded_positive_timer",
          "timer_positive_observed_s": 58.0
        },
        "pit_service_status": {
          "known_error_values": [
            102,
            105
          ],
          "observed": [
            {
              "label": "in_progress",
              "value": 2
            },
            {
              "label": "too_far_forward",
              "value": 102
            },
            {
              "label": "cant_fix_that",
              "value": 105
            }
          ],
          "source_channel": "PlayerCarPitSvStatus",
          "unavailable_reason": null
        },
        "repair_required_state": {
          "active_time_s": 70.0,
          "interpretation": "Recorded iRacing repair-required state; it does not identify a damaged component or quantify severity.",
          "source_bit_hex": "0x00100000",
          "source_channel": "SessionFlags",
          "status": "recorded_active"
        },
        "run_context": {
          "following_run_number": 2,
          "overlapping_run_numbers": [
            1,
            2
          ],
          "preceding_run_number": 1
        },
        "session_phase": "recorded_race_window",
        "source_channels": [
          "FastRepairAvailable",
          "OnPitRoad",
          "PitOptRepairLeft",
          "PitRepairLeft",
          "PitSvFlags",
          "PitstopActive",
          "PlayerCarInPitStall",
          "PlayerCarMyIncidentCount",
          "PlayerCarPitSvStatus",
          "PlayerCarTowTime",
          "PlayerFastRepairsUsed",
          "SessionFlags",
          "dpFastRepair"
        ],
        "start_sample_index": 20200,
        "start_session_time_s": 1010.0,
        "timing": {
          "nonexclusive_note": "Pit-road, stall, pit-service, tow, timer-positive, and countdown-progress clocks overlap and are not additive. Repair work is valid timer reduction, not exclusive pit loss.",
          "pit_road_time_s": 92.4,
          "pit_stall_time_s": 70.0,
          "pitstop_service_active_time_s": 58.0,
          "repair_active_time_s": 43.5,
          "repair_required_flag_active_time_s": 70.0,
          "repair_timer_positive_observed_s": 58.0,
          "repair_work_completed_s": 43.5,
          "tow_active_time_s": 18.0,
          "tow_timer_peak_s": 18.0
        },
        "tow": {
          "active_time_s": 18.0,
          "completion_status": "counted_down_to_zero",
          "first_remaining_s": 18.0,
          "last_remaining_s": 0.05,
          "peak_remaining_s": 18.0,
          "source_channel": "PlayerCarTowTime",
          "source_unit": "s",
          "status": "recorded_active"
        }
      }
    ],
    "incident_points": {
      "damage_proof": false,
      "end_count": 4.0,
      "events": [
        {
          "candidate_lap": 30,
          "count_after": 4.0,
          "count_before": 0.0,
          "damage_proof": false,
          "event_id": "incident-points-001",
          "points_added": 4.0,
          "sample_index": 20000,
          "session_time_s": 1000.0,
          "source_channel": "PlayerCarMyIncidentCount"
        }
      ],
      "note": "Incident points are never treated as proof of physical damage.",
      "positive_delta": 4.0,
      "source_channel": "PlayerCarMyIncidentCount",
      "start_count": 0.0,
      "status": "recorded_context_only"
    },
    "lap_impacts": [
      {
        "automatic_coaching_reference_eligible": false,
        "episode_ids": [
          "damage-repair-001"
        ],
        "exclusion_reason_codes": [
          "repair_correlated_candidate"
        ],
        "lap": 30
      },
      {
        "automatic_coaching_reference_eligible": false,
        "episode_ids": [
          "damage-repair-001"
        ],
        "exclusion_reason_codes": [
          "pit_tow_or_repair_episode_overlap",
          "recorded_repair_evidence",
          "repair_correlated_candidate",